{"aliases":[],"core_class":"governed_object","created_at":"2026-08-05T00:00:00Z","entity_uid":"018f0000-0000-7000-8000-000000000001","external_identities":[],"facets":["authored","traceability"],"human_key":"REQ-SW-0001","kind":"software_requirement","namespace":"demo","resource_type":"logical_object","schema_version":"1.0"}
